[
  {
    "customer_id": "C00000001",
    "campaign_id": "CMP2024_QR01",
    "y_transacted": 1,
    "txn_count_window": 3,
    "txn_amount_window_bdt": 1210.85,
    "window_start": "2024-02-01T00:00:00Z",
    "window_end": "2024-02-15T00:00:00Z"
  },
  {
    "customer_id": "C00000004",
    "campaign_id": "CMP2024_QR01",
    "y_transacted": 0,
    "txn_count_window": 0,
    "txn_amount_window_bdt": 0.0,
    "window_start": "2024-02-01T00:00:00Z",
    "window_end": "2024-02-15T00:00:00Z"
  },
  {
    "customer_id": "C00000005",
    "campaign_id": "CMP2024_QR01",
    "y_transacted": 1,
    "txn_count_window": 1,
    "txn_amount_window_bdt": 67.52,
    "window_start": "2024-02-01T00:00:00Z",
    "window_end": "2024-02-15T00:00:00Z"
  },
  {
    "customer_id": "C00000006",
    "campaign_id": "CMP2024_QR01",
    "y_transacted": 1,
    "txn_count_window": 2,
    "txn_amount_window_bdt": 1073.76,
    "window_start": "2024-02-01T00:00:00Z",
    "window_end": "2024-02-15T00:00:00Z"
  },
  {
    "customer_id": "C00000008",
    "campaign_id": "CMP2024_QR01",
    "y_transacted": 0,
    "txn_count_window": 0,
    "txn_amount_window_bdt": 0.0,
    "window_start": "2024-02-01T00:00:00Z",
    "window_end": "2024-02-15T00:00:00Z"
  },
  {
    "customer_id": "C00000010",
    "campaign_id": "CMP2024_QR01",
    "y_transacted": 1,
    "txn_count_window": 2,
    "txn_amount_window_bdt": 220.3,
    "window_start": "2024-02-01T00:00:00Z",
    "window_end": "2024-02-15T00:00:00Z"
  },
  {
    "customer_id": "C00000011",
    "campaign_id": "CMP2024_QR01",
    "y_transacted": 1,
    "txn_count_window": 4,
    "txn_amount_window_bdt": 1552.41,
    "window_start": "2024-02-01T00:00:00Z",
    "window_end": "2024-02-15T00:00:00Z"
  },
  {
    "customer_id": "C00000013",
    "campaign_id": "CMP2024_QR01",
    "y_transacted": 1,
    "txn_count_window": 2,
    "txn_amount_window_bdt": 1010.18,
    "window_start": "2024-02-01T00:00:00Z",
    "window_end": "2024-02-15T00:00:00Z"
  },
  {
    "customer_id": "C00000014",
    "campaign_id": "CMP2024_QR01",
    "y_transacted": 0,
    "txn_count_window": 0,
    "txn_amount_window_bdt": 0.0,
    "window_start": "2024-02-01T00:00:00Z",
    "window_end": "2024-02-15T00:00:00Z"
  },
  {
    "customer_id": "C00000015",
    "campaign_id": "CMP2024_QR01",
    "y_transacted": 0,
    "txn_count_window": 0,
    "txn_amount_window_bdt": 0.0,
    "window_start": "2024-02-01T00:00:00Z",
    "window_end": "2024-02-15T00:00:00Z"
  },
  {
    "customer_id": "C00000017",
    "campaign_id": "CMP2024_QR01",
    "y_transacted": 1,
    "txn_count_window": 2,
    "txn_amount_window_bdt": 1098.07,
    "window_start": "2024-02-01T00:00:00Z",
    "window_end": "2024-02-15T00:00:00Z"
  },
  {
    "customer_id": "C00000019",
    "campaign_id": "CMP2024_QR01",
    "y_transacted": 1,
    "txn_count_window": 4,
    "txn_amount_window_bdt": 1868.35,
    "window_start": "2024-02-01T00:00:00Z",
    "window_end": "2024-02-15T00:00:00Z"
  },
  {
    "customer_id": "C00000020",
    "campaign_id": "CMP2024_QR01",
    "y_transacted": 0,
    "txn_count_window": 0,
    "txn_amount_window_bdt": 0.0,
    "window_start": "2024-02-01T00:00:00Z",
    "window_end": "2024-02-15T00:00:00Z"
  },
  {
    "customer_id": "C00000022",
    "campaign_id": "CMP2024_QR01",
    "y_transacted": 0,
    "txn_count_window": 0,
    "txn_amount_window_bdt": 0.0,
    "window_start": "2024-02-01T00:00:00Z",
    "window_end": "2024-02-15T00:00:00Z"
  },
  {
    "customer_id": "C00000023",
    "campaign_id": "CMP2024_QR01",
    "y_transacted": 0,
    "txn_count_window": 0,
    "txn_amount_window_bdt": 0.0,
    "window_start": "2024-02-01T00:00:00Z",
    "window_end": "2024-02-15T00:00:00Z"
  },
  {
    "customer_id": "C00000024",
    "campaign_id": "CMP2024_QR01",
    "y_transacted": 0,
    "txn_count_window": 0,
    "txn_amount_window_bdt": 0.0,
    "window_start": "2024-02-01T00:00:00Z",
    "window_end": "2024-02-15T00:00:00Z"
  },
  {
    "customer_id": "C00000026",
    "campaign_id": "CMP2024_QR01",
    "y_transacted": 1,
    "txn_count_window": 4,
    "txn_amount_window_bdt": 1751.52,
    "window_start": "2024-02-01T00:00:00Z",
    "window_end": "2024-02-15T00:00:00Z"
  },
  {
    "customer_id": "C00000027",
    "campaign_id": "CMP2024_QR01",
    "y_transacted": 1,
    "txn_count_window": 1,
    "txn_amount_window_bdt": 211.96,
    "window_start": "2024-02-01T00:00:00Z",
    "window_end": "2024-02-15T00:00:00Z"
  },
  {
    "customer_id": "C00000029",
    "campaign_id": "CMP2024_QR01",
    "y_transacted": 0,
    "txn_count_window": 0,
    "txn_amount_window_bdt": 0.0,
    "window_start": "2024-02-01T00:00:00Z",
    "window_end": "2024-02-15T00:00:00Z"
  },
  {
    "customer_id": "C00000030",
    "campaign_id": "CMP2024_QR01",
    "y_transacted": 0,
    "txn_count_window": 0,
    "txn_amount_window_bdt": 0.0,
    "window_start": "2024-02-01T00:00:00Z",
    "window_end": "2024-02-15T00:00:00Z"
  },
  {
    "customer_id": "C00000035",
    "campaign_id": "CMP2024_QR01",
    "y_transacted": 0,
    "txn_count_window": 0,
    "txn_amount_window_bdt": 0.0,
    "window_start": "2024-02-01T00:00:00Z",
    "window_end": "2024-02-15T00:00:00Z"
  },
  {
    "customer_id": "C00000036",
    "campaign_id": "CMP2024_QR01",
    "y_transacted": 1,
    "txn_count_window": 3,
    "txn_amount_window_bdt": 989.12,
    "window_start": "2024-02-01T00:00:00Z",
    "window_end": "2024-02-15T00:00:00Z"
  },
  {
    "customer_id": "C00000037",
    "campaign_id": "CMP2024_QR01",
    "y_transacted": 1,
    "txn_count_window": 2,
    "txn_amount_window_bdt": 530.34,
    "window_start": "2024-02-01T00:00:00Z",
    "window_end": "2024-02-15T00:00:00Z"
  },
  {
    "customer_id": "C00000040",
    "campaign_id": "CMP2024_QR01",
    "y_transacted": 1,
    "txn_count_window": 2,
    "txn_amount_window_bdt": 917.54,
    "window_start": "2024-02-01T00:00:00Z",
    "window_end": "2024-02-15T00:00:00Z"
  },
  {
    "customer_id": "C00000041",
    "campaign_id": "CMP2024_QR01",
    "y_transacted": 1,
    "txn_count_window": 3,
    "txn_amount_window_bdt": 650.33,
    "window_start": "2024-02-01T00:00:00Z",
    "window_end": "2024-02-15T00:00:00Z"
  },
  {
    "customer_id": "C00000042",
    "campaign_id": "CMP2024_QR01",
    "y_transacted": 1,
    "txn_count_window": 1,
    "txn_amount_window_bdt": 442.99,
    "window_start": "2024-02-01T00:00:00Z",
    "window_end": "2024-02-15T00:00:00Z"
  },
  {
    "customer_id": "C00000043",
    "campaign_id": "CMP2024_QR01",
    "y_transacted": 0,
    "txn_count_window": 0,
    "txn_amount_window_bdt": 0.0,
    "window_start": "2024-02-01T00:00:00Z",
    "window_end": "2024-02-15T00:00:00Z"
  },
  {
    "customer_id": "C00000044",
    "campaign_id": "CMP2024_QR01",
    "y_transacted": 0,
    "txn_count_window": 0,
    "txn_amount_window_bdt": 0.0,
    "window_start": "2024-02-01T00:00:00Z",
    "window_end": "2024-02-15T00:00:00Z"
  },
  {
    "customer_id": "C00000045",
    "campaign_id": "CMP2024_QR01",
    "y_transacted": 0,
    "txn_count_window": 0,
    "txn_amount_window_bdt": 0.0,
    "window_start": "2024-02-01T00:00:00Z",
    "window_end": "2024-02-15T00:00:00Z"
  },
  {
    "customer_id": "C00000046",
    "campaign_id": "CMP2024_QR01",
    "y_transacted": 1,
    "txn_count_window": 3,
    "txn_amount_window_bdt": 1169.67,
    "window_start": "2024-02-01T00:00:00Z",
    "window_end": "2024-02-15T00:00:00Z"
  },
  {
    "customer_id": "C00000047",
    "campaign_id": "CMP2024_QR01",
    "y_transacted": 1,
    "txn_count_window": 3,
    "txn_amount_window_bdt": 2410.95,
    "window_start": "2024-02-01T00:00:00Z",
    "window_end": "2024-02-15T00:00:00Z"
  },
  {
    "customer_id": "C00000049",
    "campaign_id": "CMP2024_QR01",
    "y_transacted": 1,
    "txn_count_window": 4,
    "txn_amount_window_bdt": 2014.06,
    "window_start": "2024-02-01T00:00:00Z",
    "window_end": "2024-02-15T00:00:00Z"
  },
  {
    "customer_id": "C00000050",
    "campaign_id": "CMP2024_QR01",
    "y_transacted": 0,
    "txn_count_window": 0,
    "txn_amount_window_bdt": 0.0,
    "window_start": "2024-02-01T00:00:00Z",
    "window_end": "2024-02-15T00:00:00Z"
  },
  {
    "customer_id": "C00000051",
    "campaign_id": "CMP2024_QR01",
    "y_transacted": 0,
    "txn_count_window": 0,
    "txn_amount_window_bdt": 0.0,
    "window_start": "2024-02-01T00:00:00Z",
    "window_end": "2024-02-15T00:00:00Z"
  },
  {
    "customer_id": "C00000052",
    "campaign_id": "CMP2024_QR01",
    "y_transacted": 0,
    "txn_count_window": 0,
    "txn_amount_window_bdt": 0.0,
    "window_start": "2024-02-01T00:00:00Z",
    "window_end": "2024-02-15T00:00:00Z"
  },
  {
    "customer_id": "C00000053",
    "campaign_id": "CMP2024_QR01",
    "y_transacted": 0,
    "txn_count_window": 0,
    "txn_amount_window_bdt": 0.0,
    "window_start": "2024-02-01T00:00:00Z",
    "window_end": "2024-02-15T00:00:00Z"
  },
  {
    "customer_id": "C00000054",
    "campaign_id": "CMP2024_QR01",
    "y_transacted": 1,
    "txn_count_window": 2,
    "txn_amount_window_bdt": 352.17,
    "window_start": "2024-02-01T00:00:00Z",
    "window_end": "2024-02-15T00:00:00Z"
  },
  {
    "customer_id": "C00000057",
    "campaign_id": "CMP2024_QR01",
    "y_transacted": 0,
    "txn_count_window": 0,
    "txn_amount_window_bdt": 0.0,
    "window_start": "2024-02-01T00:00:00Z",
    "window_end": "2024-02-15T00:00:00Z"
  },
  {
    "customer_id": "C00000058",
    "campaign_id": "CMP2024_QR01",
    "y_transacted": 0,
    "txn_count_window": 0,
    "txn_amount_window_bdt": 0.0,
    "window_start": "2024-02-01T00:00:00Z",
    "window_end": "2024-02-15T00:00:00Z"
  },
  {
    "customer_id": "C00000062",
    "campaign_id": "CMP2024_QR01",
    "y_transacted": 1,
    "txn_count_window": 2,
    "txn_amount_window_bdt": 1267.43,
    "window_start": "2024-02-01T00:00:00Z",
    "window_end": "2024-02-15T00:00:00Z"
  },
  {
    "customer_id": "C00000063",
    "campaign_id": "CMP2024_QR01",
    "y_transacted": 1,
    "txn_count_window": 1,